page,text,p,start,end,type,description,wikidata,viaf,loc,notes
142,"Thursday, April 29, 1915",2,0,24,DATE,Absolute or relative dates or periods,,,,
142,Hotel Brufani Perugia,2,26,47,FAC,"Buildings, airports, highways, bridges, etc.",,,,
142,Spoleto,5,11,18,FAC,"Buildings, airports, highways, bridges, etc.",,,,
142,Mem,5,34,37,PERSON,"People, including fictional",,,,
142,the Hotel Lucini,5,55,71,FAC,"Buildings, airports, highways, bridges, etc.",,,,
142,the Val di Nera,6,5,20,FAC,"Buildings, airports, highways, bridges, etc.",,,,
142,Terni,6,24,29,GPE,"Countries, cities, states",,,,
142,Aquasparta,6,34,44,GPE,"Countries, cities, states",,,,
142,Cure,6,51,55,WORK_OF_ART,"Titles of books, songs, etc.",,,,
